{
    "SchemaVersion":  "1.0",
    "ToolVersion":  "1.0.0",
    "RunId":  "a490a106-9d3e-4389-911a-3e6540f5aca4",
    "CollectionStartedUtc":  "2026-09-23T12:24:51.3071697Z",
    "CollectionCompletedUtc":  "2026-09-23T12:26:06.6946468Z",
    "TenantAlias":  "caldova25156897",
    "TenantId":  "e2312862-df63-440c-8bcf-007a2c52859d",
    "Principal":  {
                      "Type":  "User",
                      "Id":  "b34c0d0e-dcb7-41ed-bb04-2b4535ad61cc",
                      "Upn":  "admin@caldova25156897.onmicrosoft.com"
                  },
    "Services":  {
                     "GitHub":  {
                                    "Name":  "GitHub",
                                    "RunId":  "a490a106-9d3e-4389-911a-3e6540f5aca4",
                                    "Status":  "Missing",
                                    "SourceApi":  "GitHub REST v3",
                                    "CollectedUtc":  "2026-09-23T12:24:51.3071697Z",
                                    "ResponseSha256":  "5da51227b0242f6ffb84e500b743b05c3a7e99facf0d1f10cfdcf618f56712ae",
                                    "Resources":  [
                                                      {
                                                          "Type":  "GitHubRepository",
                                                          "Id":  "1371297722",
                                                          "Name":  "caldova-hr-frontier",
                                                          "Url":  "https://api.github.com/repos/urruegg/caldova-hr-frontier",
                                                          "Scope":  "repo:urruegg/caldova-hr-frontier",
                                                          "Status":  "Found",
                                                          "EvidenceReference":  {
                                                                                    "Service":  "GitHub",
                                                                                    "SourceApi":  "GitHub REST v3",
                                                                                    "Scope":  "repo:urruegg/caldova-hr-frontier",
                                                                                    "CollectedUtc":  "2026-09-23T12:24:51.3071697Z",
                                                                                    "ResponseSha256":  "5da51227b0242f6ffb84e500b743b05c3a7e99facf0d1f10cfdcf618f56712ae"
                                                                                }
                                                      },
                                                      {
                                                          "Type":  "GitHubOidcCustomization",
                                                          "Id":  "repo:urruegg@46865858/caldova-hr-frontier@1371297722",
                                                          "Name":  "Immutable OIDC subject",
                                                          "Scope":  "repo:urruegg/caldova-hr-frontier",
                                                          "Status":  "Found",
                                                          "EvidenceReference":  {
                                                                                    "Service":  "GitHub",
                                                                                    "SourceApi":  "GitHub REST v3",
                                                                                    "Scope":  "repo:urruegg/caldova-hr-frontier",
                                                                                    "CollectedUtc":  "2026-09-23T12:24:51.3071697Z",
                                                                                    "ResponseSha256":  "5da51227b0242f6ffb84e500b743b05c3a7e99facf0d1f10cfdcf618f56712ae"
                                                                                }
                                                      },
                                                      {
                                                          "Type":  "GitHubEnvironment",
                                                          "Id":  "bootstrap-caldova25156897",
                                                          "Name":  "bootstrap-caldova25156897",
                                                          "Url":  "https://github.com/urruegg/caldova-hr-frontier/settings/environments",
                                                          "Scope":  "repo:urruegg/caldova-hr-frontier",
                                                          "Status":  "Missing",
                                                          "EvidenceReference":  {
                                                                                    "Service":  "GitHub",
                                                                                    "SourceApi":  "GitHub REST v3",
                                                                                    "Scope":  "repo:urruegg/caldova-hr-frontier",
                                                                                    "CollectedUtc":  "2026-09-23T12:24:51.3071697Z",
                                                                                    "ResponseSha256":  "5da51227b0242f6ffb84e500b743b05c3a7e99facf0d1f10cfdcf618f56712ae"
                                                                                }
                                                      }
                                                  ]
                                },
                     "Entra":  {
                                   "Name":  "Entra",
                                   "RunId":  "a490a106-9d3e-4389-911a-3e6540f5aca4",
                                   "Status":  "Missing",
                                   "SourceApi":  "Microsoft Graph v1.0",
                                   "CollectedUtc":  "2026-09-23T12:24:51.3071697Z",
                                   "ResponseSha256":  "89d576bd4a467ce6277e95a5c68a956131019297c3e1dacccfb6dde6f06c635b",
                                   "Resources":  [

                                                 ]
                               },
                     "Azure":  {
                                   "Name":  "Azure",
                                   "RunId":  "a490a106-9d3e-4389-911a-3e6540f5aca4",
                                   "Status":  "Found",
                                   "SourceApi":  "Azure Resource Graph + ARM",
                                   "CollectedUtc":  "2026-09-23T12:24:51.3071697Z",
                                   "ResponseSha256":  "042b44f9475a7768ee50c655574e8029bad01d33ef548114aba8910e5f371910",
                                   "Resources":  [
                                                     {
                                                         "Type":  "AzureSubscription",
                                                         "Id":  "edb45a24-408d-47c4-bbc7-685b9b3fc017",
                                                         "Name":  "ME-Caldova25156897-urruegg-1",
                                                         "Url":  "https://management.azure.com/subscriptions/edb45a24-408d-47c4-bbc7-685b9b3fc017",
                                                         "Scope":  "/subscriptions/edb45a24-408d-47c4-bbc7-685b9b3fc017",
                                                         "Status":  "Found",
                                                         "EvidenceReference":  {
                                                                                   "Service":  "Azure",
                                                                                   "SourceApi":  "Azure Resource Graph + ARM",
                                                                                   "Scope":  "/subscriptions/edb45a24-408d-47c4-bbc7-685b9b3fc017",
                                                                                   "CollectedUtc":  "2026-09-23T12:24:51.3071697Z",
                                                                                   "ResponseSha256":  "042b44f9475a7768ee50c655574e8029bad01d33ef548114aba8910e5f371910"
                                                                               }
                                                     },
                                                     {
                                                         "Type":  "AzureRoleAssignment",
                                                         "Id":  "/subscriptions/edb45a24-408d-47c4-bbc7-685b9b3fc017/providers/Microsoft.Authorization/roleAssignments/ed6a04db-1640-4bdf-afb2-c4a5ee0fdcb2",
                                                         "Name":  "/subscriptions/edb45a24-408d-47c4-bbc7-685b9b3fc017/providers/Microsoft.Authorization/roleDefinitions/8e3af657-a8ff-443c-a75c-2fe8c4bcb635",
                                                         "Scope":  "/subscriptions/edb45a24-408d-47c4-bbc7-685b9b3fc017",
                                                         "Status":  "Found",
                                                         "EvidenceReference":  {
                                                                                   "Service":  "Azure",
                                                                                   "SourceApi":  "Azure Resource Graph + ARM",
                                                                                   "Scope":  "/subscriptions/edb45a24-408d-47c4-bbc7-685b9b3fc017",
                                                                                   "CollectedUtc":  "2026-09-23T12:24:51.3071697Z",
                                                                                   "ResponseSha256":  "042b44f9475a7768ee50c655574e8029bad01d33ef548114aba8910e5f371910"